{
  "source_id": "uniprotkb",
  "display_name": "UniProtKB",
  "description": "Protein accessions, recommended protein names, reviewed status, sequence length, functional comments, features, and cross-references.",
  "adapter_name": "external_source_adapter",
  "dataset_types": ["GENE_PROFILE", "PROTEIN_CONTEXT"],
  "modalities": ["protein_function", "protein_feature", "annotation"],
  "access_mode": "hybrid",
  "homepage_url": "https://www.uniprot.org/",
  "api_base_url": "https://rest.uniprot.org/",
  "bulk_download_url": "https://rest.uniprot.org/uniprotkb/stream",
  "license_name": "Creative Commons Attribution 4.0 International",
  "update_frequency": "release-based",
  "priority_tier": 1,
  "provenance_tags": ["uniprot", "uniprotkb", "protein_function"],
  "data_category": "protein_context",
  "integration_status": "integrated",
  "default_params": {}
}
