{
  "source_id": "kegg",
  "display_name": "KEGG",
  "description": "Pathway and molecular interaction knowledgebase with disease and drug context.",
  "adapter_name": "external_source_adapter",
  "dataset_types": ["PATHWAY"],
  "modalities": ["pathway", "network", "compound_annotation"],
  "access_mode": "hybrid",
  "homepage_url": "https://www.kegg.jp/",
  "api_base_url": "https://rest.kegg.jp/",
  "bulk_download_url": null,
  "license_name": "KEGG licensing terms",
  "update_frequency": "continuous",
  "priority_tier": 1,
  "provenance_tags": ["pathway", "disease", "drug"],
  "data_category": "pathways_interactions_networks",
  "integration_status": "catalog_only",
  "default_params": {}
}
